{
  "schema_version": "1.0.0",
  "request_id": "a1b2c3d4-e5f6-4789-a012-3456789abcde",
  "prompt_id": "bd5a8351-2b09-4acd-9520-19875098c928",
  "session_id": "sess_home_01",
  "space_id": "home_01",
  "expected_world_revision": 7,
  "actor": {
    "actor_id": "player_001",
    "actor_type": "player"
  },
  "authority": {
    "commit_path": "world_commit_service",
    "source": "server_authoritative",
    "durable_mutation": true
  },
  "confirmation": {
    "state": "confirmed",
    "confirmed_by": "player_001"
  },
  "mutation_class": "durable_world",
  "trace_id": "trace-g1-002-commit-req"
}
